{
  "schema_version": 1,
  "phase": "6",
  "retry_caps": {
    "default": 3,
    "by_kind": {
      "cargo_check": 3,
      "cargo_clippy": 3,
      "cargo_test": 2,
      "migration": 2,
      "agent_brief": 3,
      "other": 3
    }
  },
  "tasks": [
    {
      "id": "task-78",
      "label": "verify.rs signature helper",
      "layer": 3,
      "agent": "agent-e",
      "kind": "cargo_check",
      "worktree": "C:/Users/barri/Developer/brehon-fork-agent-e-phase6",
      "status": "completed",
      "attempts": [
        {
          "n": 1,
          "started_at": "2026-04-19T05:16:32Z",
          "ended_at": "2026-04-19T05:37:23Z",
          "result": "completed",
          "commit_sha": "8eb803ce9",
          "log_path": null,
          "session_id": null,
          "transcript_path": null,
          "reason": null
        }
      ],
      "issue_url": null,
      "created_at": "2026-04-19T05:16:32Z",
      "updated_at": "2026-04-19T05:37:23Z"
    }
  ]
}
